Scallops and Blue Potatoes Carpaccio,"Ingredients : olive oil, lemon juice, salt, pepper. Wash the blue potatoes. Cook them in a large saucepan full of boiling water. Slice the scallops thinly. Peel and slice the potatoes thinly. Place the thin scallop and potato slices on the 4...",30 min    10 min, Very easy ,true
Scallops and Blue Potatoes Carpaccio 2,"Ingredients : olive oil, lemon juice, salt, pepper. Wash the blue potatoes. Cook them in a large saucepan full of boiling water. Slice the scallops thinly. Peel and slice the potatoes thinly. Place the thin scallop and potato slices on the 4...",30 min    10 min, Very easy ,true
Pastis,"Ingrédients : poivre, oeuf, pâte feuilletée, salsifi, oignon, confit de canardDégraisser le confit et l émietter. hacher les oignons et faire dorer à la poêle dans un peu de graisse de canard. ajouter le confit...",40 min,true,
Gambas au pastis,"Ingrédients : estragon, huile d olive, pastis, crème liquide, gambasDans une poêle, ou idéalement dans un wok, faites revenir à feux vif les gambas 4 mn jusqu à ce qu elles changent de couleur, salez et...",18 min,false,
Roquefort Cheese and Broccoli Pasta,"Ingredients : broccoli, roquefort, cream, pasta. Cook the broccoli ""al dente"" while cooking the pasta in a large pot. Dice the Roquefort cheese. When the pasta is done cooking, add the heavy cream and the Roquefort cheese. Salt...","", Main course ,false
Pasta carbonara,"Ingredients : pasta, egg, salt, pepper, onion. Cook the pasta in boiling water. Lice thinly and fry the onion. WHen they turn gold, add the lardons. In a salad bowl, mix the creme, the eggs, the salt and the pepper. When the lardons...",10 min, Very easy ,false
Pasta carbonara,"Ingredients : pasta, egg, salt, pepper, onion. Cook the pasta in boiling water. Lice thinly and fry the onion. WHen they turn gold, add the lardons. In a salad bowl, mix the creme, the eggs, the salt and the pepper. When the lardons...",10 min, Very easy ,false
